{
  "name": "openai-agents-python",
  "description": "OpenAI Agents SDK for Python (openai-agents) using OpenAIChatCompletionsModel and MCPServerStdio. Launch with adapters/openai-agents-python/agent.py.",
  "provider_protocol": "openai-chat-completions",
  "environment": {
    "OPENAI_BASE_URL": "{{provider_base_url}}",
    "OPENAI_API_KEY": "boundarycheck-test-key",
    "OPENAI_AGENTS_DISABLE_TRACING": "1",
    "BOUNDARYCHECK_MCP_COMMAND": "{{mcp_command}}",
    "BOUNDARYCHECK_MCP_ARGS": "{{mcp_args_json}}",
    "BOUNDARYCHECK_PROMPT": "{{scenario_prompt}}",
    "BOUNDARYCHECK_RUNTIME_INFO": "{{runtime_info_path}}"
  },
  "readiness": { "type": "provider-request", "timeout_seconds": 60 },
  "completion": { "type": "provider-scenario-complete", "exit_grace_seconds": 10 },
  "shutdown": { "grace_seconds": 3 },
  "runtime_version": { "type": "report-file" }
}
