{
  "name": "openai-agents-python-responses",
  "description": "OpenAI Agents SDK for Python with OpenAIResponsesModel and MCPServerStdio. Launch with adapters/openai-agents-python/agent.py --responses.",
  "provider_protocol": "openai-responses",
  "capabilities": [
    "history-replay",
    "persistence-resume"
  ],
  "environment": {
    "OPENAI_BASE_URL": "{{provider_base_url}}",
    "OPENAI_API_KEY": "boundarycheck-test-key",
    "OPENAI_AGENTS_DISABLE_TRACING": "1",
    "BOUNDARYCHECK_MCP_COMMAND": "{{mcp_command}}",
    "BOUNDARYCHECK_MCP_ARGS": "{{mcp_args_json}}",
    "BOUNDARYCHECK_PROMPT": "{{scenario_prompt}}",
    "BOUNDARYCHECK_SCENARIO_ID": "{{scenario_id}}",
    "BOUNDARYCHECK_RUNTIME_INFO": "{{runtime_info_path}}",
    "BOUNDARYCHECK_SESSION_DB": "{{workdir}}/agents-session.sqlite",
    "BOUNDARYCHECK_SESSION_ID": "{{run_id}}-{{scenario_id}}",
    "BOUNDARYCHECK_PROVIDER_PROTOCOL": "openai-responses"
  },
  "resume": {
    "environment": {
      "BOUNDARYCHECK_RESUME": "1"
    }
  },
  "readiness": {
    "type": "provider-request",
    "timeout_seconds": 60
  },
  "completion": {
    "type": "provider-scenario-complete",
    "exit_grace_seconds": 10
  },
  "shutdown": {
    "grace_seconds": 3
  },
  "runtime_version": {
    "type": "report-file"
  }
}
